{
  "version": "1.0",
  "generated_at": "2025-04-19T10:00:00Z",
  "duration_seconds": 60,
  "audience": "hackathon judges",
  "audience_interest": "both",
  "one_liner": "Markdown notes that sync across devices in 3 seconds.",
  "steps": [
    {"name": "opening", "max_seconds": 8,
     "say": "Hi, I'm with Notesync. In the next minute I'll show you how we make notes that sync in 3 seconds.",
     "click": "Stand still. Eye contact.",
     "show": "Team name + project name.",
     "not": "Don't start with 'so'.",
     "risks": []},
    {"name": "pain", "max_seconds": 10,
     "say": "Today, writers waste 10 minutes a day switching between apps to keep notes in sync.",
     "click": "None.",
     "show": "Quote: 'I lose ideas between apps.'",
     "not": "Don't lecture.",
     "risks": ["EXPLAIN"]},
    {"name": "product", "max_seconds": 10,
     "say": "We built Notesync. Markdown notes that sync across devices in 3 seconds.",
     "click": "Open the home screen.",
     "show": "Branded landing.",
     "not": "Don't list features.",
     "risks": []},
    {"name": "core_action", "max_seconds": 22,
     "say": "Watch: I create a note here.",
     "click": "Click '+'.",
     "show": "Note appears.",
     "not": "Don't narrate every keypress.",
     "risks": ["LAG", "OVERTIME"]},
    {"name": "result", "max_seconds": 6,
     "say": "Saved me 10 minutes today.",
     "click": "Show metric.",
     "show": "1 stat: time saved.",
     "not": "Don't show 10 metrics.",
     "risks": []},
    {"name": "close", "max_seconds": 4,
     "say": "We're Notesync. Thank you.",
     "click": "Stand still.",
     "show": "Title slide.",
     "not": "Don't mention prizes.",
     "risks": []}
  ]
}
